{
  "completeness": {
    "by_domain": {
      "A1": 33.33,
      "A2": 100.0,
      "A3": 0.0,
      "A4": 100.0,
      "A5": 40.0,
      "A6": 20.0,
      "A7": 0.0,
      "A8": 0.0
    },
    "domain_breakdown": {
      "A1": {
        "complete": 2,
        "in_scope": 2,
        "pct": 100.0
      },
      "A2": {
        "complete": 5,
        "in_scope": 5,
        "pct": 100.0
      },
      "A3": {
        "complete": 0,
        "in_scope": 0,
        "pct": 0.0
      },
      "A4": {
        "complete": 6,
        "in_scope": 6,
        "pct": 100.0
      },
      "A5": {
        "complete": 1,
        "in_scope": 1,
        "pct": 100.0
      },
      "A6": {
        "complete": 1,
        "in_scope": 1,
        "pct": 100.0
      },
      "A7": {
        "complete": 0,
        "in_scope": 0,
        "pct": 0.0
      },
      "A8": {
        "complete": 0,
        "in_scope": 0,
        "pct": 0.0
      }
    },
    "overall_pct": 36.67,
    "profile_weighted_pct": 100.0,
    "weights_used": {
      "A1": 0.13333333333333333,
      "A2": 0.26666666666666666,
      "A4": 0.26666666666666666,
      "A5": 0.19999999999999998,
      "A6": 0.13333333333333333
    }
  },
  "confidence": {
    "by_domain_cap": {
      "A1": "low",
      "A2": "high",
      "A3": "low",
      "A4": "high",
      "A5": "low",
      "A6": "low",
      "A7": "low",
      "A8": "low"
    },
    "overall_cap": "low",
    "reasons": [
      "A1 completeness < 50%",
      "A3 completeness < 50%",
      "A5 completeness < 50%",
      "A6 completeness < 50%",
      "A7 completeness < 50%",
      "A8 completeness < 50%"
    ]
  },
  "evidence_refs": [
    "EV-2026-001",
    "EV-2026-002",
    "EV-2026-007",
    "EV-2026-008",
    "EV-2026-011",
    "EV-2026-012",
    "EV-2026-016",
    "EV-2026-017",
    "EV-2026-020",
    "EV-2026-023",
    "EV-2026-024",
    "EV-2026-025",
    "EV-2026-026",
    "EV-2026-027",
    "EV-2026-028",
    "EV-2026-029",
    "EV-2026-030",
    "EV-2026-031",
    "EV-2026-032"
  ],
  "flags": {
    "triggered": [
      {
        "id": "FLAG-TIERB-PRESENT",
        "indicator_ids": [
          "IND-A5-SUP-002"
        ],
        "summary": "Tier B evidence present; confidence capped per indicator."
      }
    ],
    "watchlist": []
  },
  "indicators": [
    {
      "domain": "A1",
      "id": "IND-A1-REG-001",
      "is_complete_strict": true,
      "label": "Regulatory Quality Estimate",
      "missing_date": false,
      "missing_url": false,
      "missing_value": false,
      "notes": "World Bank WGI Regulatory Quality (estimate). Latest non-null 2023 value -0.171988308429718. WGI estimates typically range -2.5 to 2.5 (higher = stronger regulatory quality).",
      "source_institution": "World Bank (WGI)",
      "unit": "Score (-2.5 to 2.5)",
      "urls": [
        "https://api.worldbank.org/v2/country/MEX/indicator/RQ.EST?format=json"
      ],
      "value": -0.171988308429718,
      "year": null
    },
    {
      "domain": "A1",
      "id": "IND-A1-REG-002",
      "is_complete_strict": true,
      "label": "Rule of Law Estimate",
      "missing_date": false,
      "missing_url": false,
      "missing_value": false,
      "notes": "World Bank WGI Rule of Law (estimate). Latest non-null 2023 value -0.806393921375275. WGI estimates typically range -2.5 to 2.5 (higher = stronger rule of law).",
      "source_institution": "World Bank (WGI)",
      "unit": "Score (-2.5 to 2.5)",
      "urls": [
        "https://api.worldbank.org/v2/country/MEX/indicator/RL.EST?format=json"
      ],
      "value": -0.806393921375275,
      "year": null
    },
    {
      "domain": "A1",
      "id": "IND-A1-REG-003",
      "is_complete_strict": false,
      "label": "Contract Enforcement Efficiency",
      "missing_date": true,
      "missing_url": true,
      "missing_value": true,
      "notes": "",
      "source_institution": "World Bank",
      "unit": "Days / % of claim",
      "urls": [],
      "value": "VALUE(TODO)",
      "year": null
    },
    {
      "domain": "A1",
      "id": "IND-A1-REG-004",
      "is_complete_strict": false,
      "label": "Permitting Complexity Index",
      "missing_date": true,
      "missing_url": true,
      "missing_value": true,
      "notes": "",
      "source_institution": "World Bank / OECD",
      "unit": "Number of procedures / Days",
      "urls": [],
      "value": "VALUE(TODO)",
      "year": null
    },
    {
      "domain": "A1",
      "id": "IND-A1-REG-005",
      "is_complete_strict": false,
      "label": "Regulatory Burden Perception",
      "missing_date": true,
      "missing_url": true,
      "missing_value": true,
      "notes": "",
      "source_institution": "WEF",
      "unit": "Score (1-7)",
      "urls": [],
      "value": "VALUE(TODO)",
      "year": null
    },
    {
      "domain": "A1",
      "id": "IND-A1-REG-006",
      "is_complete_strict": false,
      "label": "Policy Instability Concern",
      "missing_date": true,
      "missing_url": true,
      "missing_value": true,
      "notes": "",
      "source_institution": "Fund for Peace / PRS Group",
      "unit": "Index (0-100)",
      "urls": [],
      "value": "VALUE(TODO)",
      "year": null
    },
    {
      "domain": "A2",
      "id": "IND-A2-GEO-001",
      "is_complete_strict": true,
      "label": "Trade Openness Index",
      "missing_date": false,
      "missing_url": false,
      "missing_value": false,
      "notes": "World Bank API; indicator NE.TRD.GNFS.ZS; year 2024.",
      "source_institution": "World Bank / WTO",
      "unit": "Percentage",
      "urls": [
        "https://api.worldbank.org/v2/country/MEX/indicator/NE.TRD.GNFS.ZS?format=json"
      ],
      "value": 7.5889,
      "year": null
    },
    {
      "domain": "A2",
      "id": "IND-A2-GEO-002",
      "is_complete_strict": true,
      "label": "Sanctions Alignment Risk",
      "missing_date": false,
      "missing_url": false,
      "missing_value": false,
      "notes": "No broad country-level sanctions targeting Mexico identified; compliance focuses on screening designated persons/entities under UN/UK/US lists. Decision support, not legal advice.",
      "source_institution": "United Nations Security Council; UK FCDO; US Treasury OFAC",
      "unit": "ordinal_0_2",
      "urls": [
        "https://main.un.org/securitycouncil/content/un-sc-consolidated-list",
        "https://www.gov.uk/government/publications/the-uk-sanctions-list",
        "https://ofac.treasury.gov/sanctions-list-service"
      ],
      "value": 0,
      "year": null
    },
    {
      "domain": "A2",
      "id": "IND-A2-GEO-003",
      "is_complete_strict": true,
      "label": "Geopolitical Alignment (Bloc)",
      "missing_date": false,
      "missing_url": false,
      "missing_value": false,
      "notes": "US EAR applies to US-origin items and reexports; USMCA supply chains require export control classification and licensing checks. Decision support, not legal advice.",
      "source_institution": "US BIS",
      "unit": "ordinal_0_2",
      "urls": [
        "https://www.bis.gov/regulations/ear",
        "https://www.bis.gov/licensing/country-guidance"
      ],
      "value": 1,
      "year": null
    },
    {
      "domain": "A2",
      "id": "IND-A2-GEO-004",
      "is_complete_strict": true,
      "label": "Conflict Intensity Index",
      "missing_date": false,
      "missing_url": false,
      "missing_value": false,
      "notes": "World Bank WGI PV.EST (Political Stability and Absence of Violence/Terrorism). Latest non-null 2023 value -0.630761027336121. Proxy mapping: conflict_intensity_score = clamp01((-PV + 2.5) / 5.0) * 10 = 6.26 (higher = higher conflict intensity risk).",
      "source_institution": "World Bank",
      "unit": "Score (0-10)",
      "urls": [
        "https://api.worldbank.org/v2/country/MEX/indicator/PV.EST?format=json"
      ],
      "value": 6.26,
      "year": null
    },
    {
      "domain": "A2",
      "id": "IND-A2-GEO-005",
      "is_complete_strict": true,
      "label": "High-Tech Export Restrictions",
      "missing_date": false,
      "missing_url": false,
      "missing_value": false,
      "notes": "Supplement No. 1 to 15 CFR Part 740 (eCFR) lists Mexico in Country Group A:1, A:3, A:4, A:6 and Country Group B; not listed in Country Groups D or E. Mapping: ordinal_0_2 where 0 = not in any D or E group, 1 = in D group(s) only, 2 = in E group(s). Decision support only; not legal advice.",
      "source_institution": "US BIS (eCFR)",
      "unit": "ordinal_0_2",
      "urls": [
        "https://www.ecfr.gov/current/title-15/subtitle-B/chapter-VII/subchapter-C/part-740"
      ],
      "value": 0,
      "year": null
    },
    {
      "domain": "A3",
      "id": "IND-A3-POL-001",
      "is_complete_strict": false,
      "label": "FDI Restrictiveness Index",
      "missing_date": true,
      "missing_url": true,
      "missing_value": true,
      "notes": "",
      "source_institution": "OECD",
      "unit": "Score (0-1, 0=open)",
      "urls": [],
      "value": "VALUE(TODO)",
      "year": null
    },
    {
      "domain": "A3",
      "id": "IND-A3-POL-002",
      "is_complete_strict": false,
      "label": "Gov't Support for Tech",
      "missing_date": true,
      "missing_url": true,
      "missing_value": true,
      "notes": "",
      "source_institution": "WEF / ITU",
      "unit": "Score (1-7)",
      "urls": [],
      "value": "VALUE(TODO)",
      "year": null
    },
    {
      "domain": "A3",
      "id": "IND-A3-POL-003",
      "is_complete_strict": false,
      "label": "Local Content Requirements",
      "missing_date": true,
      "missing_url": true,
      "missing_value": true,
      "notes": "",
      "source_institution": "WTO / USTR",
      "unit": "Binary / Severity Scale",
      "urls": [],
      "value": "VALUE(TODO)",
      "year": null
    },
    {
      "domain": "A3",
      "id": "IND-A3-POL-004",
      "is_complete_strict": false,
      "label": "SOE Prevalence",